{
  "version": 1,
  "id": "zhtw-project-llm-social-baseline-v1",
  "track": "blind",
  "source_class": "project_original",
  "source_urls": [
    "https://github.com/rajatim/zhtw/tree/main/benchmarks/accuracy/sources"
  ],
  "upstream_revision": "zhtw project-original LLM and everyday-social input-only source snapshot drafted 2026-07-27; raw SHA-256: 220a4748374f6a753a5b5f0e98eb6d4f90beeb7a545ab6498bd4edd98f03de92",
  "retrieved_at": "2026-07-27T23:05:00+08:00",
  "license": "MIT",
  "license_url": "https://github.com/rajatim/zhtw/blob/main/LICENSE",
  "output_license": "MIT",
  "attribution": "Copyright zhtw contributors; initial input-only LLM and everyday-social scenarios drafted by Codex and subject to independent Gemini and maintainer review.",
  "modification_notice": "Applied Unicode NFC and whitespace normalization, removed exact within-source duplicates, and added input-only candidate metadata; no converter output or expected text was used.",
  "notice_id": "zhtw-project-llm-social-baseline-v1",
  "raw_sha256": {
    "benchmarks/accuracy/sources/zhtw-project-llm-social-baseline-v1.json": "220a4748374f6a753a5b5f0e98eb6d4f90beeb7a545ab6498bd4edd98f03de92"
  },
  "normalized_path": "benchmarks/accuracy/external/zhtw-project-llm-social-baseline-v1.json",
  "normalized_sha256": "ccb3df8fc8987380e654ea694d81c037b5989dd57df2f9ce94d88bfedc4f831f",
  "importer": "scripts/import_blind_v2_source_pilot.py",
  "known_biases": [
    "These scenarios were drafted by Codex and are synthetic project-original inputs, not independently observed market traffic.",
    "The source intentionally emphasizes the underrepresented LLM and everyday-social domains.",
    "The inputs were drafted from fixed source-class and domain gaps without running zhtw, OpenCC, zhconv, or another converter.",
    "Independent Gemini and maintainer source classification remain required before promotion.",
    "The normalized source remains input-only; confirmed domain and risk labels live only in separately hashed decision and candidate-pool artifacts.",
    "A maximum of 10% of the final candidate pool may come from this source."
  ],
  "allowed_uses": [
    "evaluation",
    "public_reporting"
  ],
  "tuning_policy": "sealed_no_tuning"
}
