{
  "version": 1,
  "id": "ready-gov-winter-weather-zh-hans-v1",
  "track": "blind",
  "source_class": "public_domain",
  "source_urls": [
    "https://www.ready.gov/zh-hans/winter-weather",
    "https://uscode.house.gov/view.xhtml?req=granuleid:USC-prelim-title17-section105"
  ],
  "upstream_revision": "Ready.gov Simplified Chinese Winter Weather; page last updated 2025-11-12; retrieved HTML SHA-256: 9411cc75dda88b6cc92408ca86ca7400f3e6cf46da02371243eea3124e42723b",
  "retrieved_at": "2026-07-28T15:30:00+08:00",
  "license": "U.S. Public Domain under 17 U.S.C. 105 for FEMA-authored text; third-party linked content excluded",
  "license_url": "https://uscode.house.gov/view.xhtml?req=granuleid:USC-prelim-title17-section105",
  "output_license": "U.S. Public Domain",
  "attribution": "Federal Emergency Management Agency, Ready.gov, Winter Weather, Simplified Chinese; no FEMA, DHS, or U.S. Government endorsement or affiliation is implied.",
  "modification_notice": "Extracted only complete Simplified Chinese paragraph and list-item sentences from the checksum-pinned Ready.gov main element, removed navigation, images, external resources, phone/URL instructions, page furniture, and exact duplicates, and added input-only provenance; no expected text or converter output was used.",
  "notice_id": "ready-gov-winter-weather-zh-hans-v1",
  "raw_sha256": {
    "https://www.ready.gov/zh-hans/winter-weather": "9411cc75dda88b6cc92408ca86ca7400f3e6cf46da02371243eea3124e42723b"
  },
  "normalized_path": "benchmarks/accuracy/external/ready-gov-winter-weather-zh-hans-v1.json",
  "normalized_sha256": "4f399a7fe7b5ab55ed382d5bbfc2fd01c1fac2b83ca62d05b428cd252e8f7135",
  "importer": "scripts/import_blind_v2_source_pilot.py",
  "known_biases": [
    "Official U.S. emergency guidance is not representative of ordinary Taiwan traffic.",
    "Winter storm, cold exposure, heating, travel, and public-safety language is intentionally concentrated.",
    "List-derived fragments and inline heading joins require input-only eligibility review.",
    "Only FEMA-authored text in the main element is extracted; images, insignia, navigation, and linked third-party content are excluded.",
    "A maximum of 10% of the final candidate pool may come from this source."
  ],
  "allowed_uses": [
    "evaluation",
    "public_reporting"
  ],
  "tuning_policy": "sealed_no_tuning"
}
