{
  "version": 1,
  "id": "zhtw-project-formal-llm-overconversion-guard-v1",
  "track": "blind",
  "source_class": "project_original",
  "source_urls": [
    "https://github.com/rajatim/zhtw/tree/main/benchmarks/accuracy/sources"
  ],
  "upstream_revision": "zhtw project-original formal-document and LLM over-conversion guard input-only source snapshot drafted 2026-07-28; raw SHA-256: a1210ece239984ef6a4ceea6552c402c966ece95b872bd7195c6bcbdbdd61169",
  "retrieved_at": "2026-07-28T18:00:00+08:00",
  "license": "MIT",
  "license_url": "https://github.com/rajatim/zhtw/blob/main/LICENSE",
  "output_license": "MIT",
  "attribution": "Copyright zhtw contributors; initial input-only formal-document and LLM over-conversion guard scenarios drafted by Codex and subject to independent Gemini and maintainer review.",
  "modification_notice": "Applied Unicode NFC and whitespace normalization, removed exact within-source duplicates, and added input-only candidate metadata; no converter output or expected text was used.",
  "notice_id": "zhtw-project-formal-llm-overconversion-guard-v1",
  "raw_sha256": {
    "benchmarks/accuracy/sources/zhtw-project-formal-llm-overconversion-guard-v1.json": "a1210ece239984ef6a4ceea6552c402c966ece95b872bd7195c6bcbdbdd61169"
  },
  "normalized_path": "benchmarks/accuracy/external/zhtw-project-formal-llm-overconversion-guard-v1.json",
  "normalized_sha256": "59e2a10c0508edeb85a264d1f530209852f63af0bb3e158dd07ed987b17decd7",
  "importer": "scripts/import_blind_v2_source_pilot.py",
  "known_biases": [
    "These scenarios were drafted by Codex and are synthetic project-original inputs, not independently observed market traffic.",
    "The source intentionally concentrates on formal-document, LLM, identifier, proper-name, quote, code, and formatting-preservation contexts.",
    "The inputs were drafted from declared domain and risk coverage gaps without running zhtw, OpenCC, zhconv, or another converter.",
    "Independent Gemini review and maintainer source classification are required before promotion.",
    "The normalized source remains input-only; confirmed domain and risk labels belong only in separately hashed decision and candidate-pool artifacts.",
    "A maximum of 10% of the final candidate pool may come from this source."
  ],
  "allowed_uses": [
    "evaluation",
    "public_reporting"
  ],
  "tuning_policy": "sealed_no_tuning"
}
