{
  "version": 1,
  "id": "zhtw-project-ui-social-baseline-guard-v1",
  "track": "blind",
  "source_class": "project_original",
  "source_urls": [
    "https://github.com/rajatim/zhtw/tree/main/benchmarks/accuracy/sources"
  ],
  "upstream_revision": "zhtw project-original UI and everyday-social input-only source snapshot drafted 2026-07-30; raw SHA-256: 44c8e1981a8713c6c33ccb4a120cec8c5e73b4b55e67de6628ce878418f2a03d",
  "retrieved_at": "2026-07-30T00:17:57+08:00",
  "license": "MIT",
  "license_url": "https://github.com/rajatim/zhtw/blob/main/LICENSE",
  "output_license": "MIT",
  "attribution": "Copyright zhtw contributors; initial input-only UI and everyday-social baseline and preservation scenarios drafted by Codex and subject to independent Gemini and maintainer review.",
  "modification_notice": "Applied Unicode NFC and whitespace normalization, removed exact within-source duplicates, and added input-only candidate metadata; no converter output or expected text was used.",
  "notice_id": "zhtw-project-ui-social-baseline-guard-v1",
  "raw_sha256": {
    "benchmarks/accuracy/sources/zhtw-project-ui-social-baseline-guard-v1.json": "44c8e1981a8713c6c33ccb4a120cec8c5e73b4b55e67de6628ce878418f2a03d"
  },
  "normalized_path": "benchmarks/accuracy/external/zhtw-project-ui-social-baseline-guard-v1.json",
  "normalized_sha256": "0d9bd4b08860155504e0430f6d332890ab0690bea3a24050afccee376e1f6108",
  "importer": "scripts/import_blind_v2_source_pilot.py",
  "known_biases": [
    "These scenarios were drafted by Codex and are synthetic project-original inputs, not independently observed market traffic.",
    "The source intentionally concentrates on UI and everyday-social contexts where Blind-v2 domain coverage remains lower.",
    "The inputs were drafted from declared domain and risk coverage gaps without running any converter.",
    "Independent Gemini review and maintainer source classification are required before promotion.",
    "The normalized source remains input-only; confirmed labels belong only in separately hashed decision and candidate-pool artifacts.",
    "A maximum of 10% of the final candidate pool may come from this source."
  ],
  "allowed_uses": [
    "evaluation",
    "public_reporting"
  ],
  "tuning_policy": "sealed_no_tuning"
}
