{
  "version": 1,
  "id": "zhtw-project-it-llm-social-guard-v1",
  "track": "blind",
  "source_class": "project_original",
  "source_urls": [
    "https://github.com/rajatim/zhtw/tree/main/benchmarks/accuracy/sources"
  ],
  "upstream_revision": "zhtw project-original IT guard, LLM, and social entity input-only source snapshot drafted 2026-07-28; raw SHA-256: d9353ba6a716db782b7ef275a4dce460202a9886a66f2b26789efb77fddf617e",
  "retrieved_at": "2026-07-28T00:35:00+08:00",
  "license": "MIT",
  "license_url": "https://github.com/rajatim/zhtw/blob/main/LICENSE",
  "output_license": "MIT",
  "attribution": "Copyright zhtw contributors; initial input-only IT guard, LLM, and social entity scenarios drafted by Codex and subject to independent Gemini and maintainer review.",
  "modification_notice": "Applied Unicode NFC and whitespace normalization, removed exact within-source duplicates, and added input-only candidate metadata; no converter output or expected text was used.",
  "notice_id": "zhtw-project-it-llm-social-guard-v1",
  "raw_sha256": {
    "benchmarks/accuracy/sources/zhtw-project-it-llm-social-guard-v1.json": "d9353ba6a716db782b7ef275a4dce460202a9886a66f2b26789efb77fddf617e"
  },
  "normalized_path": "benchmarks/accuracy/external/zhtw-project-it-llm-social-guard-v1.json",
  "normalized_sha256": "2635093893426c59d227a4991f5064deca91de4ec86603affec356389b441a9a",
  "importer": "scripts/import_blind_v2_source_pilot.py",
  "known_biases": [
    "These scenarios were drafted by Codex and are synthetic project-original inputs, not independently observed market traffic.",
    "The source intentionally targets preregistered IT over-conversion, LLM candidate/baseline, and social entity-guard quota gaps.",
    "The inputs were drafted from fixed domain and risk gaps without running zhtw, OpenCC, zhconv, or another converter.",
    "Independent Gemini and maintainer source classification remain required before promotion.",
    "The normalized source remains input-only; confirmed domain and risk labels live only in separately hashed decision and candidate-pool artifacts.",
    "A maximum of 10% of the final candidate pool may come from this source."
  ],
  "allowed_uses": [
    "evaluation",
    "public_reporting"
  ],
  "tuning_policy": "sealed_no_tuning"
}
