{
  "version": 1,
  "id": "zhtw-project-social-formal-context-guard-v1",
  "track": "blind",
  "source_class": "project_original",
  "source_urls": [
    "https://github.com/rajatim/zhtw/tree/main/benchmarks/accuracy/sources"
  ],
  "upstream_revision": "zhtw project-original social/daily and formal-document input-only source snapshot drafted 2026-07-30; raw SHA-256: bb0d9fc68cfd626f333ff605333d8ea692d4140d417b2213ddbe5550c561b556",
  "retrieved_at": "2026-07-30T06:58:47+08:00",
  "license": "MIT",
  "license_url": "https://github.com/rajatim/zhtw/blob/main/LICENSE",
  "output_license": "MIT",
  "attribution": "Copyright zhtw contributors; initial input-only social/daily and formal-document scenarios drafted by Codex and subject to independent Agy/Gemini and maintainer review.",
  "modification_notice": "Applied Unicode NFC and whitespace normalization, removed exact within-source duplicates, and added input-only candidate metadata; no converter output or expected text was used.",
  "notice_id": "zhtw-project-social-formal-context-guard-v1",
  "raw_sha256": {
    "benchmarks/accuracy/sources/zhtw-project-social-formal-context-guard-v1.json": "bb0d9fc68cfd626f333ff605333d8ea692d4140d417b2213ddbe5550c561b556"
  },
  "normalized_path": "benchmarks/accuracy/external/zhtw-project-social-formal-context-guard-v1.json",
  "normalized_sha256": "0c2dcb76333806c3efc5129ddf9bb2854bfd3faa56634399add3d9749b345a83",
  "importer": "scripts/import_blind_v2_source_pilot.py",
  "known_biases": [
    "These scenarios were drafted by Codex and are synthetic project-original inputs, not independently observed market traffic.",
    "The source intentionally concentrates on social/daily and formal-document contexts where Blind-v2 domain coverage remains lower.",
    "The inputs were drafted from declared domain and risk coverage gaps without running any converter.",
    "Independent Agy/Gemini review and maintainer source classification are required before promotion.",
    "The normalized source remains input-only; confirmed labels belong only in separately hashed decision and candidate-pool artifacts.",
    "A maximum of 10% of the final candidate pool may come from this source."
  ],
  "allowed_uses": [
    "evaluation",
    "public_reporting"
  ],
  "tuning_policy": "sealed_no_tuning"
}
