{
  "version": 1,
  "id": "ready-gov-home-fires-zh-hans-v1",
  "track": "blind",
  "source_class": "public_domain",
  "source_urls": [
    "https://www.ready.gov/zh-hans/home-fires",
    "https://uscode.house.gov/view.xhtml?req=granuleid:USC-prelim-title17-section105"
  ],
  "upstream_revision": "Ready.gov Simplified Chinese Home Fires; page last updated 2025-10-31; retrieved HTML SHA-256: 42142f589d716969cb5aca13c9b7d3dd3e521cc87faa4556c2690648cbb83ff7",
  "retrieved_at": "2026-07-27T10:00:00+08:00",
  "license": "U.S. Public Domain under 17 U.S.C. 105 for FEMA-authored text; third-party linked content excluded",
  "license_url": "https://uscode.house.gov/view.xhtml?req=granuleid:USC-prelim-title17-section105",
  "output_license": "U.S. Public Domain",
  "attribution": "Federal Emergency Management Agency, Ready.gov, Home Fires, Simplified Chinese; no FEMA, DHS, or U.S. Government endorsement or affiliation is implied.",
  "modification_notice": "Extracted only complete Simplified Chinese paragraph and list-item sentences from the checksum-pinned Ready.gov main element, removed navigation, images, external resources, phone/URL instructions, page furniture, and exact duplicates, and added input-only provenance; no expected text or converter output was used.",
  "notice_id": "ready-gov-home-fires-zh-hans-v1",
  "raw_sha256": {
    "https://www.ready.gov/zh-hans/home-fires": "42142f589d716969cb5aca13c9b7d3dd3e521cc87faa4556c2690648cbb83ff7"
  },
  "normalized_path": "benchmarks/accuracy/external/ready-gov-home-fires-zh-hans-v1.json",
  "normalized_sha256": "76a56bd96aeae1b1f0884621c7375f1b5230e83da4d35c5d1cc2c28cc8e895fc",
  "importer": "scripts/import_blind_v2_source_pilot.py",
  "known_biases": [
    "Official U.S. emergency guidance is not representative of ordinary Taiwan traffic.",
    "Fire prevention, evacuation, burns, smoke alarms, and emergency-response language is intentionally concentrated.",
    "List-derived fragments and inline heading joins require input-only eligibility review.",
    "Only FEMA-authored text in the main element is extracted; images, insignia, navigation, and linked third-party content are excluded.",
    "A maximum of 10% of the final candidate pool may come from this source."
  ],
  "allowed_uses": ["evaluation", "public_reporting"],
  "tuning_policy": "sealed_no_tuning"
}
