{
  "version": 1,
  "id": "ready-gov-campus-zh-hans-v1",
  "track": "blind",
  "source_class": "public_domain",
  "source_urls": [
    "https://www.ready.gov/zh-hans/campus",
    "https://uscode.house.gov/view.xhtml?req=granuleid:USC-prelim-title17-section105"
  ],
  "upstream_revision": "Ready.gov Simplified Chinese Campus Preparedness; page last updated 2025-10-29; retrieved HTML SHA-256: 7cda67cb9e65fd57fb3d68eb087406a3cdcd99e273057659fce0002ed4ffbf1c",
  "retrieved_at": "2026-07-28T20:00:00+08:00",
  "license": "U.S. Public Domain under 17 U.S.C. 105 for FEMA-authored text; third-party linked content excluded",
  "license_url": "https://uscode.house.gov/view.xhtml?req=granuleid:USC-prelim-title17-section105",
  "output_license": "U.S. Public Domain",
  "attribution": "Federal Emergency Management Agency, Ready.gov, Campus Preparedness, Simplified Chinese; no FEMA, DHS, or U.S. Government endorsement or affiliation is implied.",
  "modification_notice": "Extracted only complete Simplified Chinese paragraph and list-item sentences from the checksum-pinned Ready.gov main element, removed navigation, images, external resources, phone/URL instructions, page furniture, and exact duplicates, and added input-only provenance; no expected text or converter output was used.",
  "notice_id": "ready-gov-campus-zh-hans-v1",
  "raw_sha256": {
    "https://www.ready.gov/zh-hans/campus": "7cda67cb9e65fd57fb3d68eb087406a3cdcd99e273057659fce0002ed4ffbf1c"
  },
  "normalized_path": "benchmarks/accuracy/external/ready-gov-campus-zh-hans-v1.json",
  "normalized_sha256": "19d45586201d05f5f200f3dffdfa2a808ad406b515db702ad87e321bf31f7be0",
  "importer": "scripts/import_blind_v2_source_pilot.py",
  "known_biases": [
    "Official U.S. emergency guidance is not representative of ordinary Taiwan traffic.",
    "Campus emergency-planning, weather-alert, evacuation, and training language is intentionally concentrated.",
    "List-derived fragments and inline heading joins require input-only eligibility review.",
    "Only FEMA-authored text in the main element is extracted; images, insignia, navigation, and linked third-party content are excluded.",
    "A maximum of 10% of the final candidate pool may come from this source."
  ],
  "allowed_uses": [
    "evaluation",
    "public_reporting"
  ],
  "tuning_policy": "sealed_no_tuning"
}
