{
  "version": 1,
  "id": "ready-gov-tornadoes-zh-hans-v1",
  "track": "blind",
  "source_class": "public_domain",
  "source_urls": [
    "https://www.ready.gov/zh-hans/tornadoes",
    "https://uscode.house.gov/view.xhtml?req=granuleid:USC-prelim-title17-section105"
  ],
  "upstream_revision": "Ready.gov Simplified Chinese Tornadoes; page last updated 2025-11-12; retrieved HTML SHA-256: f9fcbe3c53fb45f1f948046eb0864905bbdc7915762ad5a0c60c7063e0b2ebdd",
  "retrieved_at": "2026-07-28T15:00:00+08:00",
  "license": "U.S. Public Domain under 17 U.S.C. 105 for FEMA-authored text; third-party linked content excluded",
  "license_url": "https://uscode.house.gov/view.xhtml?req=granuleid:USC-prelim-title17-section105",
  "output_license": "U.S. Public Domain",
  "attribution": "Federal Emergency Management Agency, Ready.gov, Tornadoes, Simplified Chinese; no FEMA, DHS, or U.S. Government endorsement or affiliation is implied.",
  "modification_notice": "Extracted only complete Simplified Chinese paragraph and list-item sentences from the checksum-pinned Ready.gov main element, removed navigation, images, external resources, phone/URL instructions, page furniture, and exact duplicates, and added input-only provenance; no expected text or converter output was used.",
  "notice_id": "ready-gov-tornadoes-zh-hans-v1",
  "raw_sha256": {
    "https://www.ready.gov/zh-hans/tornadoes": "f9fcbe3c53fb45f1f948046eb0864905bbdc7915762ad5a0c60c7063e0b2ebdd"
  },
  "normalized_path": "benchmarks/accuracy/external/ready-gov-tornadoes-zh-hans-v1.json",
  "normalized_sha256": "3c47e904649de37cc10396b39ce5014dc2fe426e44c0d0e662b8ebfc376c6ed5",
  "importer": "scripts/import_blind_v2_source_pilot.py",
  "known_biases": [
    "Official U.S. emergency guidance is not representative of ordinary Taiwan traffic.",
    "Tornado, sheltering, evacuation, weather-alert, and public-safety language is intentionally concentrated.",
    "List-derived fragments and inline heading joins require input-only eligibility review.",
    "Only FEMA-authored text in the main element is extracted; images, insignia, navigation, and linked third-party content are excluded.",
    "A maximum of 10% of the final candidate pool may come from this source."
  ],
  "allowed_uses": [
    "evaluation",
    "public_reporting"
  ],
  "tuning_policy": "sealed_no_tuning"
}
