{
  "version": 1,
  "id": "zhtw-project-formal-llm-context-guard-v1",
  "track": "blind",
  "source_class": "project_original",
  "source_urls": [
    "https://github.com/rajatim/zhtw/tree/main/benchmarks/accuracy/sources"
  ],
  "upstream_revision": "zhtw project-original formal-news and LLM context-guard input-only source snapshot drafted 2026-07-28; raw SHA-256: 101016fbada993c4b9d9982d993d277a0d60dc41a172cb1c6bb80719e410f748",
  "retrieved_at": "2026-07-28T22:44:24+08:00",
  "license": "MIT",
  "license_url": "https://github.com/rajatim/zhtw/blob/main/LICENSE",
  "output_license": "MIT",
  "attribution": "Copyright zhtw contributors; initial input-only formal-news and LLM context-guard scenarios drafted by Codex and subject to independent Gemini and maintainer review.",
  "modification_notice": "Applied Unicode NFC and whitespace normalization, removed exact within-source duplicates, and added input-only candidate metadata; no converter output or expected text was used.",
  "notice_id": "zhtw-project-formal-llm-context-guard-v1",
  "raw_sha256": {
    "benchmarks/accuracy/sources/zhtw-project-formal-llm-context-guard-v1.json": "101016fbada993c4b9d9982d993d277a0d60dc41a172cb1c6bb80719e410f748"
  },
  "normalized_path": "benchmarks/accuracy/external/zhtw-project-formal-llm-context-guard-v1.json",
  "normalized_sha256": "60812b246d58aa2869b98fe55ecc0b8ced52091dda6ff054ad5c4aa343e1b9ae",
  "importer": "scripts/import_blind_v2_source_pilot.py",
  "known_biases": [
    "These scenarios were drafted by Codex and are synthetic project-original inputs, not independently observed market traffic.",
    "The source intentionally concentrates on formal-news and LLM semantic context where domain coverage remains lower.",
    "The inputs were drafted from declared domain and risk coverage gaps without running any converter.",
    "Independent Gemini review and maintainer source classification are required before promotion.",
    "The normalized source remains input-only; confirmed labels belong only in separately hashed decision and candidate-pool artifacts.",
    "A maximum of 10% of the final candidate pool may come from this source."
  ],
  "allowed_uses": ["evaluation", "public_reporting"],
  "tuning_policy": "sealed_no_tuning"
}
